{
  "schemaVersion": 2,
  "layoutId": "00000000-0000-4000-8000-000000000100",
  "name": "Accueil par défaut",
  "canvas": {
    "width": 1920,
    "height": 1080,
    "background": {
      "type": "image",
      "asset": "assets/background-default.webp",
      "mode": "cover",
      "focusX": 0.5,
      "focusY": 0.5
    },
    "renderTarget": "1080p"
  },
  "nodes": [
    {
      "id": "greeting",
      "kind": "text",
      "x": 90,
      "y": 170,
      "width": 1000,
      "height": 220,
      "zIndex": 20,
      "props": {
        "role": "greeting",
        "text": "Bonjour,\nBienvenue en salle de réunion 1",
        "fontScale": 1.0,
        "maxLines": 2
      }
    },
    {
      "id": "clock-weather",
      "kind": "clock",
      "x": 1210,
      "y": 50,
      "width": 610,
      "height": 110,
      "zIndex": 20,
      "props": {
        "showDate": true,
        "showWeather": true,
        "format": "24h"
      }
    },
    {
      "id": "sources",
      "kind": "source",
      "x": 90,
      "y": 520,
      "width": 410,
      "height": 125,
      "zIndex": 20,
      "focusOrder": 1,
      "props": {
        "source": "menu",
        "label": "Sources"
      }
    },
    {
      "id": "messages",
      "kind": "message",
      "x": 1160,
      "y": 285,
      "width": 610,
      "height": 400,
      "zIndex": 20,
      "props": {
        "title": "ACTUALITÉS",
        "feed": "default",
        "maximumItems": 3
      }
    },
    {
      "id": "network",
      "kind": "network",
      "x": 90,
      "y": 970,
      "width": 700,
      "height": 45,
      "zIndex": 20,
      "props": {
        "label": "RÉSEAU",
        "value": "À CONFIGURER DANS L’ADMINISTRATION"
      }
    },
    {
      "id": "logo",
      "kind": "logo",
      "x": 1505,
      "y": 850,
      "width": 285,
      "height": 145,
      "zIndex": 30,
      "props": {
        "asset": "assets/logo-placeholder.png",
        "fit": "contain",
        "anchor": "bottom-right"
      }
    }
  ]
}
